cve_id,hash,repo_url,msg,merge,parents,num_files,num_lines_added,num_lines_deleted
GHSA-qc36-q22q-cjw3,8bfc20506cc5e098fe6eb3d1cafe3bea791215ce,https://github.com/lettre/lettre,"fix(transport-smtp): Fix transparency codec - 0.9.x (#628)

Co-authored-by: Paolo Barbolini <paolo@paolo565.org>",0,d930c42d5069e344a9dfa84ebe4b60bf3b11ac64,1,11,2
GHSA-r626-fc64-3q28,34c2b9e,https://github.com/SonicFrog/abox,send/sync fix to prevent misuse,0,5abe75222bc49af6b62ea37f87d7be0c56973310,1,2,2
GHSA-88xq-w8cq-xfg7,886ecc562040bef61faf19438c22285c2d62403a,https://github.com/bytecodealliance/wasmtime,"Merge pull request from GHSA-88xq-w8cq-xfg7

This commit fixes the drop of an uninitialized `VMExternRef` for an `externref`
global in an instance that failed to be allocated by the pooling instance
allocator.

The following engine configuration (via `Config`) is required to be impacted by
this bug:

* support for the reference types proposal must be enabled (this is the
  default for `Config`).
* a pooling allocation strategy must be configured via
  `Config::allocation_strategy`, which is not the default allocation strategy.

A module must be instantiated with the following characteristics:

* The module defines at least one table or memory.
* The module defines at least one `externref` global.

During instantiation, one of the following must occur to cause the
instantiation to fail:

* a call to `mprotect` or `VirtualAlloc` fails (e.g. out-of-memory conditions).
* a resource limiter was configured in the associated Store (via `Store::limiter`
  or `Store::limiter_async`) and the limiter returns false from the initial call
  to grow_memory or grow_table.

This results in a partially-initialized instance being dropped and that attempts
to drop the uninitialized `VMExternRef` representing the defined `externref` global.

The fix is to track whether or not the `VMContext` of the instance has been fully
initialized and skip the dropping of globals if not.",0,39b88e4e9e8115e4a9da2c1e3423459edf0a648e,3,74,1
GHSA-2wc6-2rcj-8v76,24c7a5550807ac8a09648b5878f19d14c3a69135,https://github.com/sodiumoxide/sodiumoxide,Check the return value of `scalarmult()`. Closes #154,0,12d49e8ed1b53821465f24312695376eb86c89d2,1,55,46
GHSA-q3cc-7p7g-392c,ac30e169ae51b262bc8cf7026469851ce39b23c6,https://github.com/rusqlite/rusqlite,Use SmallCString in most places,0,552416039ec700471167c22f32e07d7d2126cea1,3,16,12
GHSA-m296-j53x-xv95,7ab8a264980d23c2ed64e72f4636f38b7381eb39,https://github.com/KizzyCode/tiny_future,Require `Send` for underlying types to fix https://github.com/KizzyCode/tiny_future/issues/1,0,c7919199a0f6d1ce0e3c33499d1b37f862c990e4,1,2,2
GHSA-m296-j53x-xv95,c7919199a0f6d1ce0e3c33499d1b37f862c990e4,https://github.com/KizzyCode/tiny_future,Require `Send` for underlying types to fix https://github.com/KizzyCode/tiny_future/issues/1,0,50bd80f874c851413a721bbe144eeba4dfb68b4e,1,1,1
GHSA-8h4j-vm3r-vcq3,2ef3628dac35aeba0a97d5fb3a57746b4e1d62b3,https://github.com/rusqlite/rusqlite,Actually fix auxdata api...,0,71b2f5187b0cbace3f8b6ff53432ff2ca0defcf0,1,54,65
GHSA-p24j-h477-76q3,bf2b2df9c9e218e35e5a38ce3d03cffb7c363956,https://github.com/sharkdp/bat,"Fix for Windows: do not run binaries from CWD

This fixes a bug on Windows where `Command::new` would also run
executables from the current working directory, possibly resulting in
accidental runs of programs called `less`.",0,3617c98cf5de9996c29fe73bc7fc4126768497f3,2,41,2
GHSA-f6g6-54hm-fhxv,a34d6e1,https://github.com/mvertescher/libsbc-rs,"Add R: Send bound to Send impl of Decoder<R>
fixes issue #4",0,7278b23901f93d956d9739fdfc4ced147cc3f242,1,1,1
GHSA-686f-ch3r-xwmh,92f40b4a2c671553dfa96feacff0265206c44ce5,https://github.com/udoprog/unicycle,Make Send + Sync bounds conditional (fixes #8),0,f5a283826ef91e5a07f4b43fea9ec8ae281f84cb,2,4,4
GHSA-hf79-8hjp-rrvq,7c7757c772fb709c61b1442bcc1e1fbee97bf4a8,https://github.com/bytecodealliance/lucet,"Merge pull request from GHSA-hf79-8hjp-rrvq

* Use manual drop

* Add some comments to `ManuallyDrop` usage

* rustfmt

Co-authored-by: Aaron Turon <aturon@fastly.com>
Co-authored-by: Alex Crichton <alex@alexcrichton.com>",0,8fb1fece339927e178f6cfef4eb67328b500237d,1,26,13
GHSA-fqq2-xp7m-xvm8,b0d2bd20eb40b9cbc2958b981ba2dcd9e6f9396e,https://github.com/RusPiRo/ruspiro-singleton,fix soundness,0,0565f8ef459bd336eda8a6a63d1d50cdb581c2b3,1,4,2
GHSA-rmff-f8w9-c9rm,0a1da873ddb29bca926bad8301f8d7ab8aa97c52,https://github.com/edarc/max7301,"Fix unsoundness in ImmediateIO and TransactionalIO, aka RUSTSEC-2020-0152 aka
edarc/max7301#1.

Unsafe impls of Sync for both of these structs are removed, and Send bounds are
introduced where necessary to allow Sync to be properly deduced instead.

The unsafe impls were introduced due to an incorrect analysis of why Sync was
not being auto-deduced as expected for these structs. The removed comment
explains the original flawed analysis, which attributed it to the presence of a
struct member of type PhantomData<EI>, under the assumption that the only
""real"" value of type EI in the struct is ultimately inside an IOMutex that
should bless it with Sync-ness regardless if EI is itself Sync.

In fact, Sync was not being deduced due to the absence of a *Send* bound on the
type EI, which is required for Expander<EI> to be Send, which is required for
IOMutex<Expander<EI>> to be *Sync*. The presence of the PhantomData<EI> member
turns out to be entirely irrelevant.

The bug could theoretically result in a data race if either type is used with
an EI that is not safe to send between threads.

This is a breaking change due to the addition of a trait bound in the public
API.",0,fb11c86f9bc2c45c0bc3fd14b5780c9c47f6320e,5,32,52
GHSA-hpcx-3pw8-g3j2,2820cf12f2e08645fd6d1f15b4a90a54d6082a81,https://github.com/Yoric/telemetry.rs,"Resolves #45 - Fix security vulnerability, get rid of every unsafe code.",0,5c810a8345be7d763ab1c4a716683188e36aceb4,3,6,40
GHSA-g4w7-3qr8-5623,71b2f5187b0cbace3f8b6ff53432ff2ca0defcf0,https://github.com/rusqlite/rusqlite,Ensure type use for auxdata is repr(C),0,38aea89809ea4154975d853bffe3cb7715fe84d6,1,16,6
GHSA-v4cp-h94r-m7xf,d2ce1ac753afc059e32798bac3383b81a6d04456,https://github.com/bytecodealliance/wasmtime,"Fix a use-after-free bug when passing `ExternRef`s to Wasm

We _must not_ trigger a GC when moving refs from host code into
Wasm (e.g. returned from a host function or passed as arguments to a Wasm
function). After insertion into the table, this reference is no longer
rooted. If multiple references are being sent from the host into Wasm and we
allowed GCs during insertion, then the following events could happen:

* Reference A is inserted into the activations table. This does not trigger a
  GC, but does fill the table to capacity.

* The caller's reference to A is removed. Now the only reference to A is from
  the activations table.

* Reference B is inserted into the activations table. Because the table is at
  capacity, a GC is triggered.

* A is reclaimed because the only reference keeping it alive was the activation
  table's reference (it isn't inside any Wasm frames on the stack yet, so stack
  scanning and stack maps don't increment its reference count).

* We transfer control to Wasm, giving it A and B. Wasm uses A. That's a use
  after free.

To prevent uses after free, we cannot GC when moving refs into the
`VMExternRefActivationsTable` because we are passing them from the host to Wasm.

On the other hand, when we are *cloning* -- as opposed to moving -- refs from
the host to Wasm, then it is fine to GC while inserting into the activations
table, because the original referent that we are cloning from is still alive and
rooting the ref.",0,4b256ab9682a5ae5e364137e9de1feefe040ee35,14,665,106
GHSA-7cqg-8449-rmfv,11ba23a9766a5079918cd9f515bc100bc8164b50,https://github.com/paritytech/libsecp256k1,Prevent side channel leak in Scala::check_overflow,0,91d4b499d625d4a24f68f1317acc4e96d4ac2904,2,23,17
GHSA-773q-5334-5gf9,19ade85,https://github.com/rust-blockchain/evm,Skip setting memory value if the value vec is empty,0,2a8a3e967ec265fdc7120ff6b57ceab021ca69f6,1,4,0
GHSA-8mjx-h23h-w2pg,2a4d53809e3000f40085f2b229b6b1a33759881d,https://github.com/thepowersgang/stack_dst-rs,Avoid double-drops when `clone` panics in slice push. Fixes #5,0,807e9d45019c02369e11d40bd181cbf7bb7981fc,2,55,11
GHSA-m9m5-cg5h-r582,5ba218ac29df4786b002d7d12b47fa0c04a331f2,https://github.com/Absolucy/nanorand-rs,fix: Fix random number generation,0,7bf49ecbb254991585c04dd4f4d2a23cb16a1240,1,7,7
RUSTSEC-2019-0038,7fd282aef7787577c385aed88cb25d004b85f494,https://github.com/jnqnfe/pulse-binding-rust,"use `catch_unwind` with callbacks

Per Rust documentation, it is undefined behaviour to panic into foreign
code, thus a panic-catcher is needed at the boundary point where PA calls
into our Rust binding, which only happens with callback execution. This is
exactly the sort of thing that `std::panic::catch_unwind` is meant for.",0,c1e20e87c6a6f975b48b959cfafec24fd2eae14f,14,252,175
GHSA-5xg3-j2j6-rcx4,f01846bd443aaf92fdd5ac20f461beac3f6ee3fd,https://github.com/dandavison/delta,"Do not resolve executables as relative path from current directory (#658)

* Refactor: child pager process creation

* Protect calls to Command::new behind grep_cli::resolve_binary

* Move less env-var setting into less-specific branch",0,2826bdd75b31f42aac1c80b2302c25e739a8adf1,3,161,66
RUSTSEC-2018-0004,8f28ec275e412dd3af4f3cda460605512faf332c,https://github.com/ruuda/claxon,"Fix bug in decoding residuals

A partition order could occur, such that the block size was not a
multiple of 2^order. Computation of the number of samples per partition
did not account for this case, rounding down due to the bit shift. This
meant that we would not fill the entire decode buffer.

Claxon does not zero the decode buffer because it is (should be)
overwritten anyway, and in the case of a format error, where the buffer
might be only partially full, the buffer is not exposed again.
Furthermore, the way decoding works in most places, is that we fill the
entire buffer, just by looping to fill it. If the input bitstream does
not contain enough data to fill the buffer, then that's a format error.
In a few places though, we need to slice up the buffer before decoding
into it: for decoding individual channels, and also for decoding
residuals, which are split into partitions.

This particular format error was especially nasty because it did not
cause a format error down the line. Instead, it caused the buffer to be
sliced in a way where the slices together did not cover the entire
buffer, and so parts of uninitialized memory could remain in the buffer.

Thanks a lot to Sergey ""Shnatsel"" Davidoff for reporting this bug,
together with elaborate steps to reproduce that allowed me to pinpoint
the cause quickly.",0,cd82be35f413940ba446d2a19f10d74b86466487,1,19,6
GHSA-28ph-f7gx-fqj8,3c6b57fe1b2cc87e7ebecde43dd836ffb1c4ea5c,https://github.com/rusqlite/rusqlite,Fix vtab::Module lifetime,0,e85963852d0320c50686ecf70dbca124c600de4a,5,87,90
RUSTSEC-2020-0161,01940637dd8f3bfeeee3faf9639fa9ae52f19f4d,https://gitlab.com/KonradBorowski/array-macro,"Always call methods on references in a macro

The macro scope cannot be trusted to not contain trait implementations
which try to break this crate. To avoid this, explicitly reference
variables on which methods are called.",0,eb1d8121dd2083898798937c84a16f9125b81baf,2,16,3
GHSA-w3g5-2848-2v8r,f7d120a3b724d06a7b623d0a4306acf8f78cb4f0,https://github.com/Xudong-Huang/generator-rs,:pencil: fix send issue (#27),0,96885a9eb1d81d7de2eaa24dda824c1904230ece,5,85,41
GHSA-8928-2fgm-6x9x,e965d8298f421e9c89fe98b1300b8361e948c324,https://github.com/actix/actix-web,HRS security fixes (#2363),0,f6e69919ede4872c1d987b4b932c44580190971c,4,562,330
GHSA-hw4v-5x4h-c3xm,0b962f218f0cdd796dadfe26c3f09e68f7861b26,https://github.com/paritytech/frontier,Add transaction cost pre-validation (#465),0,4b6c80808209d5ea7a2d3225b572214667a27cd2,1,42,0
GHSA-gwc9-348x-qwv2,666c2554ea0e1728c35aa41178cf235920db888a,https://github.com/bytecodealliance/wasmtime,"Merge pull request from GHSA-gwc9-348x-qwv2

* Run the GC smoketest with epoch support enabled as well.

* Handle safepoints in cold blocks properly.

Currently, the way that we find safepoint slots for a given instruction
relies on the instruction index order in the safepoint list matching the
order of instruction emission.

Previous to the introduction of cold-block support, this was trivially
satisfied by sorting the safepoint list: we emit instructions 0, 1, 2,
3, 4, ..., and so if we have safepoints at instructions 1 and 4, we will
encounter them in that order.

However, cold blocks are supported by swizzling the emission order at
the last moment (to avoid having to renumber instructions partway
through the compilation pipeline), so we actually emit instructions out
of index order when cold blocks are present.

Reference-type support in Wasm in particular uses cold blocks for
slowpaths, and has live refs and safepoints in these slowpaths, so we
can reliably ""skip"" a safepoint (not emit any metadata for it) in the
presence of reftype usage.

This PR fixes the emission code by building a map from instruction index
to safepoint index first, then doing lookups through this map, rather
than following along in-order as it emits instructions.",0,353f1b48ab73aab92e014b214a7770cbbf99c2ab,4,46,15
GHSA-45w7-7g63-2m5w,2a4d538,https://github.com/thepowersgang/stack_dst-rs,Avoid double-drops when `clone` panics in slice push. Fixes #5,0,807e9d45019c02369e11d40bd181cbf7bb7981fc,2,55,11
GHSA-8r7q-r9mx-35rh,2327d3b774927fdf48903c0bdc1ca7ec93c7c8d0,https://github.com/rusqlite/rusqlite,Fix format string error in rusqlite::trace::log,0,abbab7216a8b47108a0e1b7a26e429d6a990d7a6,1,1,1
GHSA-6hfq-h8hq-87mf,8f93123efef5c1361086688fe4f34c83c89cec02,https://github.com/hyperium/hyper,"fix(http1): fix server misinterpretting multiple Transfer-Encoding headers

When a request arrived with multiple `Transfer-Encoding` headers, hyper
would check each if they ended with `chunked`. It should have only
checked if the *last* header ended with `chunked`.

See https://github.com/hyperium/hyper/security/advisories/GHSA-6hfq-h8hq-87mf",0,4d2125c67c8087de863f74278a017c4caf37e6a9,1,12,0
GHSA-67hm-27mx-9cg7,d44011a69e0674acfa9c59bd7ad7f0523eb61d42,https://github.com/denoland/deno,fix(runtime): require full read and write permissions to create symlinks (#12554),0,b7341438f29de88f3458b32a835bfad560bda52e,1,34,4
GHSA-mc22-5q92-8v85,1a2efcdbe68e5e7fd0a05836ac32d2cde78a0b2e,https://github.com/tremor-rs/tremor-runtime,"Remove patch and merge in_place optimizations.

They are too dangerous and can lead to memory unsafety.

Also added proper state handling to script based tests.

Signed-off-by: Matthias Wahl <mwahl@wayfair.com>",0,bffc2a555bc4922bbb36b7186445477d8c0d0193,7,40,152
GHSA-m5pq-gvj9-9vr8,ae70b41d4f46641dbc45c7a4f87954aea356283e,https://github.com/rust-lang/regex,"security: fix denial-of-service bug in compiler

The regex compiler will happily attempt to compile '(?:){294967295}' by
compiling the empty sub-expression 294,967,295 times. Empty
sub-expressions don't use any memory in the current implementation, so
this doesn't trigger the pre-existing machinery for stopping compilation
early if the regex object gets too big. The end result is that while
compilation will eventually succeed, it takes a very long time to do so.

In this commit, we fix this problem by adding a fake amount of memory
every time we compile an empty sub-expression. It turns out we were
already tracking an additional amount of indirect heap usage via
'extra_inst_bytes' in the compiler, so we just make it look like
compiling an empty sub-expression actually adds an additional 'Inst' to
the compiled regex object.

This has the effect of causing the regex compiler to reject this sort of
regex in a reasonable amount of time by default.

Many thanks to @VTCAKAVSMoACE for reporting this, providing the valuable
test cases and continuing to test this patch as it was developed.

Fixes https://github.com/rust-lang/regex/security/advisories/GHSA-m5pq-gvj9-9vr8",0,b92ffd5471018419ec48dbdef32757424439f065,2,95,2
GHSA-3cgf-9m6x-pwwr,45fd77ee43c38eea4d6f4e2e56c1667a55ec654f,https://github.com/rusqlite/rusqlite,UnlockNotification should hold mutex when calling condvar,0,c9ef5bd63cad5c0c123344c072b490a1a9bcbe1f,1,9,11
GHSA-9qmm-4mfr-r3wj,e61e045f8c244de978401d186dcfd50838817297,https://github.com/solana-labs/rbpf,jit: sign-extend the quotient register on sdiv32 (#310),0,792fb1ebc074919c001c7db757d094229371eff1,2,32,1
GHSA-h6xw-mghq-7523,b4e6dc76f4845ab03104187a42ac6d1bbc1e0021,https://github.com/waycrate/swhkd,[patch] CVE-2022-27819,0,4a4d76df3b3df1bd0bc132694e2985770a95e464,1,34,21
GHSA-862g-9h5m-m3qv,2a36405339c87b16ed6c76e91ad5b76638fbdb0c,https://github.com/coreos/coreos-installer,"install: restrict access permissions on /boot/ignition{,/config.ign}

The Ignition config may contain secrets.  Don't expose it, or anything in
its parent directory, to unprivileged processes.

https://github.com/coreos/fedora-coreos-tracker/issues/889",0,1239f0cb60efb398c0cd545a81877c26f9f83897,1,26,3
GHSA-p4jg-pccf-h82c,e661a4940df78fbb7b52c622ac4ae6a3a7f7d8aa,https://github.com/waycrate/swhkd,[patch] CVE-2022-27815,0,0b620a09605afb815c6d8d8953bbb7a10a8c0575,1,6,2
GHSA-6q5w-m3c5-rv95,c9ef5bd63cad5c0c123344c072b490a1a9bcbe1f,https://github.com/rusqlite/rusqlite,Make VTab / VTabCursor `unsafe trait` as implmenting them on the wrong type is unsound,0,3c6b57fe1b2cc87e7ebecde43dd836ffb1c4ea5c,4,13,9
GHSA-3227-r97m-8j95,da7904c04f82e1cb43cc42eaf6a1dba072b5c921,https://github.com/Basicprogrammer10/afire,🎗 Fix Path Traversal Exploit,0,5644d94eec95abe9323d99e307851a52957777d5,1,10,2
GHSA-8m49-2xj8-67v9,0b620a09605afb815c6d8d8953bbb7a10a8c0575,https://github.com/waycrate/swhkd,[patch] CVE-2022-27816,0,f70b99dd575fab79d8a942111a6980431f006818,1,1,1
GHSA-cjg2-2fjg-fph4,8a93fdc6c9f4eb1d2f2a11b7ff1d12d70bf5a664,https://github.com/paritytech/frontier,"Handle 0 exponent with fudged length correctly in ModExp (#549)

* Handle 0 exponent with fudged length correctly in ModExp

* cargo fmt

* Revert to following EIP-2565 strictly, subtract after adding terms to prevent underflow

* Update frame/evm/precompile/modexp/src/lib.rs

Clean up test case

Co-authored-by: Wei Tang <accounts@that.world>

* More revert

* cargo fmt

* Prefer expect to match

Co-authored-by: Wei Tang <accounts@that.world>",0,6dd07a4d581a4c00bb2a2238a81997fc75bc2127,1,51,5
GHSA-r3r5-jhw6-4634,f70b99dd575fab79d8a942111a6980431f006818,https://github.com/waycrate/swhkd,[patch] CVE-2022-27818,0,b4e6dc76f4845ab03104187a42ac6d1bbc1e0021,2,7,9
GHSA-5rrv-m36h-qwf8,9e9f1fb44114078c000c78c72e691eeb9e7ac260,https://github.com/sagebind/isahc,fix #2,0,298bf062a27339dd3411c932e5ac2e91a497e43a,1,16,1
RUSTSEC-2020-0078,49b43f277afb1caf5104fcbe02bef581f7444686,https://github.com/deprecrated/net2-rs,"Do not assume memory layout of std::net::SocketAddr

Fixes #105

Reviewed by: Thomas de Zeeuw <thomasdezeeuw@gmail.com>",0,77a6eb4d5eb36adc81ee21ab7ffebc62fdf2ab88,2,124,10
GHSA-62jx-8vmh-4mcw,d90a02f582c03dfa0fd11c78d608d0974625ae5d,https://github.com/alexcrichton/tar-rs,"Don't create directories before we've verified they're inside the tar destination (#259)

Fixes #238

Co-authored-by: Robert O'Callahan <robert@ocallahan.org>",0,860858be1ef65b3640c27ed752ea080995f86a64,3,57,6
RUSTSEC-2020-0042,369e55736f9bd29c37b1712afc2923f4028148c6,https://github.com/arcnmx/stack-rs,"Add bounds check to Vector::insert

Fixes #4",0,76cc1855a3ce966182bcf6fb2dc6a1d765cb5138,1,2,1
GHSA-8q2v-67v7-6vc6,b8f9011c04f104bb4a20f44e5bce31a1e9b46e64,https://github.com/SergioBenitez/Rocket,"Fix 'LocalRequest::clone()' soundness issue.

The existing implementation of 'LocalRequest::clone()' mistakenly copied
the internal 'Request' pointer from the existing 'LocalRequest' to the
cloned 'LocalRequest'. This resulted in an aliased '*mut Request'
pointer, a clear soundness issue. The fix in this commit is to clone the
internal 'Request', replacing the internal pointer with the newly cloned
'Request' when producing the cloned 'LocalRequest'. A fix that removes
all 'unsafe' code should be explored.

Fixes #1312.",0,ca4d1572d408fd8dd13db103926ad96da878126d,2,53,4
GHSA-3jc5-5hc5-33gj,268301a714934dd067ba33f59f22c5f003aa20f3,https://github.com/oliver-giersch/conquer-once,further restricts `Send` for `OnceCell` (fixes #3),0,06db899114401235392321af8225b55e2290e1f6,1,1,1
RUSTSEC-2021-0044,e325e2fce4d9f9f392761e9fb58b418a48cef8bb,https://github.com/SergioBenitez/Rocket,"Fix soundness issue: make 'Formatter' panic-safe.

Fixes #1534.",0,c24f15c18f02319be83af4f3c1951dc220b52c5e,1,86,19
GHSA-4hjg-cx88-g9f9,8783a08e71694b7a5eb4fbc7cd95379b6de0d290,https://github.com/Matthias247/futures-intrusive,Add a Sync bound for GenericMutexGuard. Fixes #53. (#54),0,9ee6993ec7619f87dbbf0c995c19ef24b26586e6,1,7,0
RUSTSEC-2021-0073,59f2a7311dd6540696bfd0145f5281ce495f4385,https://github.com/tokio-rs/prost,"Fix #438: Check for overflow in `Duration` and `Timestamp` processing (#439)

* Check for overflow in `{Duration,Timestamp}::normalize`.

* Check for overflow when converting `Timestamp` to `SystemTime`.

Whether or not such an overflow is possible depends on the platform. It does not appear possible on `x86_64-unknown-linux-gnu` (which represents time with a 64-bit signed integer for seconds, same as `Timestamp`), but it is possible on `i686-unknown-linux-gnu` (which represents time with a 32-bit signed integer for seconds) and `x86_64-pc-windows-msvc` (which has a different representation of time altogether).

* Add documentation for `TimestampOutOfSystemRangeError`.

* Apply rustfmt.

Co-authored-by: Lucio Franco <luciofranco14@gmail.com>",0,0833d467bd55ee7ff427e0484fc299366ad9ab7d,1,264,16
RUSTSEC-2021-0003,85593a484173c574027d7897b980f729bb1f454f,https://github.com/servo/rust-smallvec,"Fix potential buffer overflow in `insert_many`

Fixes #252.",0,0b2b4e53a5cf86740b2515907dd53252b3b59401,2,26,1
GHSA-3qm2-rfqw-fmrw,18abedadaa77646cce6f2ca2149c0119a2e4f428,https://github.com/okready/scratchpad,"Fix double drop during panic unwinds

The `SliceMoveSource` and `SliceMoveSourceCollection` trait
implementations for arrays and boxed slices do not do anything to
inhibit the dropping of elements in the source array or box until after
all elements have been ""consumed"" by the provided closure. Under normal
""happy path"" operation, this doesn't pose any issues, but if an
unwinding panic occurs during closure execution, the element currently
being consumed and all previous elements in the source array or box will
be dropped even though ownership should have already been moved out of
the source.

For array-based sources, this commit addresses the issue by using an
internal consuming iterator that inhibits dropping for elements that
have already been consumed while dropping elements that have not been
consumed if the iterator is dropped before being exhausted (as could
occur during panic unwinds). For boxed slice sources, the boxed slice is
simply converted to a `Vec`, and the default iterator conversion for
`Vec`s (which is already unwind-safe) is used.

Fixes #1.",0,0cc776fb47e5339259675eca5548dc524aa7c550,4,304,30
GHSA-wp34-mqw5-jj85,6b83f9d0708337a9f8b709c1624a8587021ceba2,https://github.com/bennetthardwick/nano-arena,"Fix #1, add tests",0,f5306c73a0f8f260eb49f9f0a8509ef85f038244,1,55,2
RUSTSEC-2020-0091,dfeb84bfce2be11327749c152b3c8f4ea4304e12,https://github.com/vorner/arc-swap,"Fix soundness hole around access::Map

The assumption that the address of access's guarded reference stays the
same is not true.

Costs:
* The Map is now slower and adds an allocation.
* It can stop being Copy (but non-trivial guards weren't anyway) and
  it can stop being Sync/Send if the closure is not.
* The taken closure needs to be Clone.

Fixes #45.

Technically, it is a breaking change, but the plan is not to raise major
version, because:

* Even rust std gives exception to break compatibility for soundness
  hole fixes.
* It is not that likely people's code would break.
* Even if it breaks, they are much more likely to go to the fixed
  version then if the version got bumped and that's what they should be
  doing ASAP due to the potential UB.",0,b5ec44cd5d9b4b4a491cf85c1cbb2b1d5cdae061,2,20,37
GHSA-r57r-j98g-587f,340f893dbc9db3e43c6315b05eff4b0b150220d2,https://github.com/Absolucy/nanorand-rs,fix: Fix aliased mutable references with `TlsWyRand` (fixes #28),0,8e282f2f413d7cac73adf6a20c31bc4d5800cb8b,1,15,20
RUSTSEC-2021-0019,1660818b60832fdf58b982a37d81f5ef10abe0be,https://github.com/rust-x-bindings/rust-xcb,"string returned from X can be invalid utf-8 (#108)

fixes #96",0,121acde839901c33cde938a527f50993838dee89,1,53,9
RUSTSEC-2021-0014,6299af0ab17f070a78b75367e14b9101c29ce475,https://github.com/blackbeam/rust-marc,Remove unsafe code (fix #7),0,e626775a6998e1f97c8c1a242362602924e1693f,1,1,2
RUSTSEC-2020-0008,0867ad5c15fa52b7af3fc840ee7a1e256c469942,https://github.com/hyperium/hyper,"fix(client): allow client GET requests with explicit body headers

Closes #1925",0,ac45f1ac4508454f4e6b2ce26c1235dfdb169230,2,221,45
GHSA-39xg-8p43-h76x,6dd7ca0d50f2464df708975cdafcfaeeb6d41c66,https://github.com/diwic/reffers-rs,"Fix unsoundness in arefs/arefss::map/try_map

Closes: #7

Thanks to Youngsuk Kim (CS PhD student @ Georgia Tech)
for discovering this issue!",0,34d987860eb84c9e7ddc9a87c289bd6a7029576d,1,5,5
GHSA-v5r6-6r3c-wqxc,dbc7ab1c739667eb26aace1b9a6795192ed4a805,https://github.com/KizzyCode/asn1_der-rust,Fixed https://github.com/KizzyCode/asn1_der/issues/1 and added tests for this case,0,2e781a3e7de7e687ce5d7774bde963057abff4ae,2,7,8
